{
  "id": "statspack",
  "version": "0.1.0",
  "label": "\ud83d\udcd0 Statistics Pack",
  "description": "Hypothesis tests and effect-size primitives. Adds two-sample t-test and two-sample Kolmogorov-Smirnov as first-class steps so analysts can compare groups without leaving the pipeline editor.",
  "author": "DataInsightGrove",
  "license": "AGPL-3.0",
  "homepage": "https://github.com/SFCyris/DataInsightGrove",
  "minDigVersion": "0.10.0",
  "steps": [
    "t_test",
    "ks_test"
  ],
  "connectors": [],
  "pythonRequirements": [
    "scipy>=1.11"
  ],
  "checksum": "sha256:f74a13bd577fa866096cd6a8fd78dcc874eca4f1b9e38b352d090f28040ec071"
}
