{
  "id": "dates_pack",
  "version": "0.1.0",
  "label": "📅 Dates Pack",
  "description": "Calendar arithmetic that the built-in extract_date_parts doesn't cover: fiscal-year math, business-day spans (with country holidays), and start-of-period snapping.",
  "author": "DataInsightGrove",
  "license": "AGPL-3.0",
  "homepage": "https://github.com/SFCyris/DataInsightGrove",
  "minDigVersion": "0.6.0",
  "steps": ["fiscal_year_parts", "business_days_between", "date_snap"],
  "connectors": [],
  "pythonRequirements": ["holidays>=0.40"]
}
